60168	κατά	kata/	downwards, down, against	1 κατά [adv. ]	de haut en bas ; en arrière ; du haut de ; en suivant de haut en bas, en descendant ; en tombant sur ; en regardant vers	vers le bas, vers le bas, contre	abwärts, abwärts, gegen	27631	343
62253	κατακόπτω	katako/ptw	to cut down, cut in pieces, cut up	κατακόπτω	abattre ou enlever en coupant ; couper en morceaux	couper, couper en morceaux, couper	abschneiden, in Stücke schneiden, zerschneiden	138	343
77700	ὀρίνω	o)ri/nw	to stir, raise, agitate	ὀρίνω	mettre en mouvement, remuer, soulever ; poursuivre	remuer, élever, agiter	umrühren, erhöhen, bewegen	61	343
88044	πρᾶξις	pra=cis	a doing, transaction	πρᾶξις [gens : εως (ἡ) ]	action ; manière d'agir ou manière d'être ; résultat d'une action, suite, conséquence	un faire, une transaction	ein Tun, eine Transaktion	1609	343
103578	συγχέω	sugxe/w	to pour together, commingle, confound	συγχέω	verser ensemble	verser ensemble, mélanger, confondre	zusammen gießen, vermischen, verwirren	155	343
105633	συντρίβω	suntri/bw	to rub together	συντρίϐω	frotter l'un contre l'autre ; broyer ensemble ; broyer, briser	se frotter ensemble	aneinander reiben	100	343
26109	ἀσφάλεια	a)sfa/leia	security	ἀσφάλεια [gens : ας (ἡ) ]	le fait de ne pas glisser, allure ferme	Sécurité	Sicherheit	480	344
! 51958	εὐνομέομαι	eu)nome/omai	to have good laws, to be orderly			avoir de bonnes lois, être ordonné	gute Gesetze haben, ordentlich sein	41	344
58117	ἰθύνω	i)qu/nw	to make straight, straighten	ἰθύνω	aligner, tracer en droite ligne ; diriger en droite ligne ; redresser, corriger	faire droit, redresser	gerade machen, begradigen	46	344
64304	κηρωτή	khrwth/	cerate	ἡ κηρωτή (in κηρωτός) [des : ή, όν, subst. ]	mélange de cire avec de l'huile, de la gomme, cérat ; céruse	Cerate	Cerate	40	344
78725	οὔκουν	ou)/koun	certainly not	οὔκουν [adv. ]	certes ne... pas, assurément ne... pas ; pourtant ne... pas, cependant ne... pas ; donc ne... pas, par conséquent ne... pas ; donc ne... pas ? en vérité ne... pas ? ; eh ! bien donc, est-ce que ne... pas	certainement pas	sicherlich nicht	360	344
88045	πρᾶγμα	pra=gma	deed, occurrence, pl. affairs	πρᾶγμα [gens : ατος (τὸ) ]	affaire ; action de faire, action d'entreprendre ; ce qui est fait, ce qui existe, événement, chose, affaire	acte, occurrence, pl. affaires	Tat, Vorkommen, pl. Angelegenheiten	4310	344
106662	τέμενος	te/menos	sacred precinct	τέμενος [gens : εος-ους (τὸ) ]	portion de territoire qu'on réservait aux chefs, enclos servant de résidence ; portion de territoire (champ ou bois), avec un autel ou un temple, consacrée à une divinité	enceinte sacrée	heiliger Bezirk	302	344
10590	ἁλίσκομαι	a(li/skomai	to be caught	ἁλίσκομαι	être pris ; être pris en flagrant délit ; être condamné	être attrapé	gefangen werden	1007	345
* 56061	γραμματικός	grammatiko/s	knowing one's letters	γραμματικός [des : ή, όν ]@ὁ γραμματικός (in γραμματικός) [des : ή, όν ]@ὁ γραμματικός (in γραμματικός) [des : ή, όν ]	qui concerne l'art de lire ou d'écrire ; qui concerne les lettres ; orné de lettres gravées@scribe, secrétaire@qui enseigne à lire et à écrire	Connaître ses lettres	Die Briefe kennen	98	345
* 51959	εὐνομία	eu)nomi/a	good order, order	2 εὐνομία [gens : ας (ἡ) ]@1 εὐνομία [gens : ας (ἡ) ]	bon pâturage ; action de faire paître dans de bons pâturages@ordre bien réglé	bon ordre, ordre	gute Ordnung, Ordnung	51	345
81846	παρασκευή	paraskeuh/	preparation	παρασκευή [gens : ῆς (ἡ) ]	action de préparer, préparation ; ce qui a été préparé, ce qui est à la disposition de ; le fait d'être préparé à qqe ch., disposition naturelle, qualités, ressources ; approche, arrivée de la fièvre	préparation	Vorbereitung	735	345
106663	τέμνω	te/mnw	cut, maim; sacrifice, divide	τέμνω	couper, (avec un couteau, avec les dents, etc.) ; enlever en coupant ; découper ; couper en perçant ou en piquant, percer ; préparer, fabriquer ou faire en coupant ; traverser en coupant, fendre	couper, mutiler; sacrifier, diviser	schneiden, verstümmeln; opfern, teilen	924	345
51960	εὐνοῦχος	eu)nou=xos	a eunuch	εὐνοῦχος [gens : ου (ὁ) adj. ]	eunuque (gardien de la couche, gardien des femmes) ; yeux privés de sommeil	un eunuque	ein Eunuch	112	346
346	Ἡράκλειος	*(hra/kleios	of Hercules	Ἡράκλειος [des : α ος, ον subst. ]	d'Hèraklès, qui concerne Hèraklès	d'Hercule	von Herkules	150	346
88047	πρᾶος	pra=os	mild, soft, gentle	πρᾶος < πρᾷος [adj. ]	doux, bon	doux, doux, doux	mild, weich, sanft	256	346
15753	ἀμηχανέω	a)mhxane/w	to be ἀμήχανος, to be at a loss for, or in want of	ἀμηχανέω	n'avoir pas le moyen de ; être dans l'embarras pour vivre, être sans ressources	être ἀμήχανος, être à perte ou en manque de	ἀμήχανος sein, ratlos sein oder wollen	42	347
* 11628	ἄπειμι1	a)/peimi1	go away	1 ἄπειμι@2 ἄπειμι	être loin de ; être absent@s'en aller, partir	allez-vous en	Geh weg	299	347
* 11629	ἄπειμι2	a)/peimi2	go away, depart; to be discharged	1 ἄπειμι@2 ἄπειμι	être loin de ; être absent@s'en aller, partir	partez, partez; être libéré	geh weg, geh weg; entladen werden	299	347
* 11630	ἄπειρος1	a)/peiros1	inexperienced of, ignorant; boundless	2 ἄπειρος [des : ος, ον ]@1 ἄπειρος [des : ος, ον, ]@ἄπειρος > ἤπειρος	sans fin, infini ; inextricable ; sans terme marqué@sans expérience de, ignorant de@terre ferme ; plaine	inexpérimenté, ignorant; sans bornes	unerfahren, unwissend; grenzenlos	57	347
* 11631	ἄπειρος2	a)/peiros2	boundless	2 ἄπειρος [des : ος, ον ]@1 ἄπειρος [des : ος, ον, ]@ἄπειρος > ἤπειρος	sans fin, infini ; inextricable ; sans terme marqué@sans expérience de, ignorant de@terre ferme ; plaine	sans bornes	grenzenlos	57	347
